Stock Code,Company Name
MSIN,MNC Digital Entertainment Tbk.
BIKE,Sepeda Bersama Indonesia Tbk.
ADRO,Adaro Energy Indonesia Tbk.
ZBRA,Dosni Roha Indonesia Tbk.
GOTO,GoTo Gojek Tokopedia Tbk.
IBFN,Intan Baru Prana Tbk.
MTMH,Murni Sadar Tbk.
SICO,Sigma Energy Compressindo Tbk.
TLDN,Teladan Prima Agro Tbk.
WIRG,WIR ASIA Tbk.
IBOS,Indo Boga Sukses Tbk.
OLIV,Oscar Mitra Sukses Sejahtera Tbk.
WINR,Winner Nusantara Jaya Tbk.
ASHA,Cilacap Samudera Fishing Industry Tbk.
ARKO,Arkora Hydro Tbk.
AXIO,Tera Data Indonusa Tbk.
CHEM,Chemstar Indonesia Tbk.
DEWI,Dewi Shri Farmindo Tbk.
HATM,Habco Trans Maritima Tbk.
KRYA,Bangun Karya Perkasa Jaya Tbk.
SWID,Saraswanti Indoland Development Tbk.
TRGU,Cerestar Indonesia Tbk.
AMMS,Agung Menjangan Mas Tbk.
BUAH,Segar Kumala Indonesia Tbk.
CRAB,Toba Surimi Industries Tbk.
ELPI,Pelayaran Nasional Ekalya Purnamasari Tbk.
EURO,Estee Gold Feet Tbk.
GULA,Aman Agrindo Tbk.
JARR,Jhonlin Agro Raya Tbk.
KKES,Kusuma Kemindo Sentosa Tbk.
KLIN,Klinko Karya Imaji Tbk.
MEDS,Hetzer Medical Indonesia Tbk.
MORA,Mora Telematika Indonesia Tbk.
OASA,Maharaksa Biru Energi Tbk.
RAFI,Sari Kreasi Boga Tbk.
RCCC,Utama Radar Cahaya Tbk.
TELE,Omni Inovasi Indonesia Tbk.
TOOL,Rohartindo Nusantara Luas Tbk.
BHIT,MNC Asia Holding Tbk.
BPFI,Woori Finance Indonesia Tbk.
COAL,Black Diamond Resources Tbk.
PALM,Provident Investasi Bersama Tbk.
BBSI,Krom Bank Indonesia Tbk.
BELI,Global Digital Niaga Tbk.
BSBK,Wulandari Bangun Laksana Tbk.
CBUT,Citra Borneo Utama Tbk.
KDTN,Puri Sentul Permai Tbk.
KETR,Ketrosden Triasmitra Tbk.
MKTR,Menthobi Karyatama Raya Tbk.
OMED,Jayamas Medica Industri Tbk.
PDPP,Primadaya Plastisindo Tbk.
PRAY,Famon Awal Bros Sedaya Tbk.
ZATA,Bersama Zatta Jaya Tbk.
VRNA,Mizuho Leasing Indonesia Tbk.
NINE,Techno9 Indonesia Tbk.
MMIX,Multi Medika Internasional Tbk.
PADA,Personel Alih Daya Tbk.
ISAP,Isra Presisi Indonesia Tbk.
VTNY,Venteny Fortuna International Tbk.
AGII,Samator Indo Gas Tbk.
BEER,Jobubu Jarum Minahasa Tbk.
CBPE,Citra Buana Prasida Tbk.
ELIT,Data Sinergitama Jaya Tbk.
SOUL,Mitra Tirta Buwana Tbk.
CBRE,Cakra Buana Resources Energi Tbk.
SUNI,Sunindo Pratama Tbk.
WINE,Hatten Bali Tbk.
BMBL,Lavender Bina Cendikia Tbk.
PEVE,Penta Valent Tbk.
LAJU,Jasa Berdikari Logistics Tbk.
FWCT,Wijaya Cahaya Timber Tbk.
NAYZ,Hassana Boga Sejahtera Tbk.
IRSX,Aviana Sinar Abadi Tbk.
CHIP,Pelita Teknologi Global Tbk.
HALO,Haloni Jane Tbk.
PACK,Solusi Kemasan Digital Tbk.
VAST,Vastland Indonesia Tbk.
KING,Hoffmen Cleanindo Tbk.
SMBR,Semen Baturaja Tbk.
PGEO,Pertamina Geothermal Energy Tbk.
FUTR,Lini Imaji Kreasi Ekosistem Tbk.
HILL,Hillcon Tbk.
BDKR,Berdikari Pondasi Perkasa Tbk.
PTMP,Mitra Pack Tbk.
CUAN,Petrindo Jaya Kreasi Tbk.
SAGE,Saptausaha Gemilangindah Tbk.
TRON,Teknologi Karya Digital Nusa Tbk.
NSSS,Nusantara Sawit Sejahtera Tbk.
PSSI,IMC Pelita Logistik Tbk.
AWAN,Era Digital Media Tbk.
GTRA,Grahaprima Suksesmandiri Tbk.
HAJJ,Arsy Buana Travelindo Tbk.
MBMA,Merdeka Battery Materials Tbk.
MENN,Menn Teknologi Indonesia Tbk.
NCKL,Trimegah Bangun Persada Tbk.
PIPA,Multi Makmur Lemindo Tbk.
DOOH,Era Media Sejahtera Tbk.
JATI,Informasi Teknologi Indonesia Tbk.
MPXL,MPX Logistics International Tbk.
RAAM,Tripar Multivision Plus Tbk.
SMIL,Sarana Mitra Luas Tbk.
TYRE,King Tire Indonesia Tbk.
KLAS,Pelayaran Kurnia Lautan Semesta Tbk.
MAXI,Maxindo Karya Anugerah Tbk.
AMMN,Amman Mineral Internasional Tbk.
CRSN,Carsurin Tbk.
GRPM,Graha Prima Mentari Tbk.
RELF,Graha Mitra Asia Tbk.
TGUK,Platinum Wahab Nusantara Tbk.
VKTR,VKTR Teknologi Mobilitas Tbk.
WIDI,Widiant Jaya Krenindo Tbk.
INET,Sinergi Inti Andalan Prima Tbk.
KREN,Quantum Clovera Investama Tbk.
LIFE,MSIG Life Insurance Indonesia Tbk.
MAHA,Mandiri Herindo Adiperkasa Tbk.
PANI,Pantai Indah Kapuk Dua Tbk.
RMKO,Royaltama Mulia Kontraktorindo Tbk.
CNMA,Nusantara Sejahtera Raya Tbk.
CYBR,ITSEC Asia Tbk.
ERAL,Sinar Eka Selaras Tbk.
FOLK,Multi Garam Utama Tbk.
GRIA,Ingria Pratama Capitalindo Tbk.
HBAT,Minahasa Membangun Hebat Tbk.
HUMI,Humpuss Maritim Internasional Tbk.
LMAX,Lupromax Pelumas Indonesia Tbk.
MSIE,Multisarana Intan Eduka Tbk.
MUTU,Mutuagung Lestari Tbk.
PPRI,Paperocks Indonesia Tbk.
AEGS,Anugerah Spareparts Sejahtera Tbk.
BABY,Multitrend Indo Tbk.
RSCH,Charlie Hospital Semarang Tbk.
ULTJ,Ultrajaya Milk Industry & Trading Company Tbk.
BREN,Barito Renewables Energy Tbk.
ESSA,ESSA Industries Indonesia Tbk.
IOTF,Sumber Sinergi Makmur Tbk.
KOCI,Kokoh Exa Nusantara Tbk.
KOKA,Koka Indonesia Tbk.
LOPI,Logisticsplus International Tbk.
PTPS,Pulau Subur Tbk.
STRK,Lovina Beach Brewery Tbk.
IKPM,Ikapharmindo Putramas Tbk.
MSTI,Mastersystem Infotama Tbk.
RGAS,Kian Santang Muliatama Tbk.
UDNG,Agro Bahari Nusantara Tbk.
AYAM,Janu Putra Sejahtera Tbk.
SURI,Maja Agung Latexindo Tbk.
ACRO,Samcro Hyosung Adilestari Tbk.
ASLI,Asri Karya Lestari Tbk.
CGAS,Citra Nusantara Gemilang Tbk.
GRPH,Griptha Putra Persada Tbk.
MANG,Manggung Polahraya Tbk.
MSJA,Multi Spunindo Jaya Tbk.
NICE,Adhi Kartiko Pratama Tbk.
SMLE,Sinergi Multi Lestarindo Tbk.
SMGA,Sumber Mineral Global Abadi Tbk.
TPIA,Chandra Asri Pacific Tbk.
ALII,Ancara Logistics Indonesia Tbk.
MPIX,Mitra Pedagang Indonesia Tbk.
TOSK,Topindo Solusi Komunika Tbk.
UNTD,Terang Dunia Internusa Tbk.
LIVE,Homeco Victoria Makmur Tbk.
MEJA,Harta Djaya Karya Tbk.
MKAP,Multikarya Asia Pasifik Raya Tbk.
HYGN,Ecocare Indo Pasifik Tbk.
BAIK,Bersama Mencapai Puncak Tbk.
