Stock Code,Company Name
AALI,Astra Agro Lestari Tbk.
ABBA,Mahaka Media Tbk.
ABDA,Asuransi Bina Dana Arta Tbk.
ABMM,ABM Investama Tbk.
ACES,Ace Hardware Indonesia Tbk.
ACST,Acset Indonusa Tbk.
ADES,Akasha Wira International Tbk.
ADHI,Adhi Karya (Persero) Tbk.
ADMF,Adira Dinamika Multi Finance Tbk.
ADMG,Polychem Indonesia Tbk
ADRO,Adaro Energy Tbk.
AGII,Aneka Gas Industri Tbk.
AGRO,Bank Rakyat Indonesia Agroniaga Tbk.
AGRS,Bank Agris Tbk.
AHAP,Asuransi Harta Aman Pratama Tbk.
AIMS,Akbar Indo Makmur Stimec Tbk
AISA,Tiga Pilar Sejahtera Food Tbk.
AKKU,Anugerah Kagum Karya Utama Tbk.
AKPI,Argha Karya Prima Industry Tbk.
AKRA,AKR Corporindo Tbk.
AKSI,Majapahit Inti Corpora Tbk.
ALDO,Alkindo Naratama Tbk.
ALKA,Alakasa Industrindo Tbk
ALMI,Alumindo Light Metal Industry Tbk.
ALTO,Tri Banyan Tirta Tbk.
AMAG,Asuransi Multi Artha Guna Tbk.
AMFG,Asahimas Flat Glass Tbk.
AMIN,Ateliers Mecaniques D Indonesie Tbk.
AMRT,Sumber Alfaria Trijaya Tbk.
ANDI,Andira Agro Tbk.
ANJT,Austindo Nusantara Jaya Tbk.
ANTM,Aneka Tambang Tbk.
APEX,Apexindo Pratama Duta Tbk.
APIC,Pacific Strategic Financial Tbk.
APII,Arita Prima Indonesia Tbk.
APLI,Asiaplast Industries Tbk.
APLN,Agung Podomoro Land Tbk.
APOL,Arpeni Pratama Ocean Line Tbk.
ARGO,Argo Pantes Tbk
ARII,Atlas Resources Tbk.
ARMY,Armidian Karyatama Tbk.
ARNA,Arwana Citramulia Tbk.
ARTA,Arthavest Tbk
ARTI,Ratu Prabu Energi Tbk
ARTO,Bank Artos Indonesia Tbk.
ASBI,Asuransi Bintang Tbk.
ASDM,Asuransi Dayin Mitra Tbk.
ASGR,Astra Graphia Tbk.
ASII,Astra International Tbk.
ASJT,Asuransi Jasa Tania Tbk.
ASMI,Asuransi Kresna Mitra Tbk.
ASRI,Alam Sutera Realty Tbk.
ASRM,Asuransi Ramayana Tbk.
ASSA,Adi Sarana Armada Tbk.
ATIC,Anabatic Technologies Tbk.
ATPK,Bara Jaya Internasional Tbk.
AUTO,Astra Otoparts Tbk.
BABP,Bank MNC Internasional Tbk.
BACA,Bank Capital Indonesia Tbk.
BAJA,Saranacentral Bajatama Tbk.
BALI,Bali Towerindo Sentra Tbk.
BAPA,Bekasi Asri Pemula Tbk.
BATA,Sepatu Bata Tbk.
BAYU,Bayu Buana Tbk
BBCA,Bank Central Asia Tbk.
BBHI,Bank Harda Internasional Tbk.
BBKP,Bank Bukopin Tbk.
BBLD,Buana Finance Tbk.
BBMD,Bank Mestika Dharma Tbk.
BBNI,Bank Negara Indonesia (Persero) Tbk.
BBNP,Bank Nusantara Parahyangan Tbk.
BBRI,Bank Rakyat Indonesia (Persero) Tbk.
BBRM,Pelayaran Nasional Bina Buana Raya Tbk.
BBTN,Bank Tabungan Negara (Persero) Tbk.
BBYB,Bank Yudha Bhakti Tbk.
BCAP,MNC Kapital Indonesia Tbk.
BCIC,Bank JTrust Indonesia Tbk.
BCIP,Bumi Citra Permai Tbk.
BDMN,Bank Danamon Indonesia Tbk.
BEKS,Bank Pembangunan Daerah Banten Tbk.
BELL,Trisula Textile Industries Tbk.
BEST,Bekasi Fajar Industrial Estate Tbk.
BFIN,BFI Finance  Indonesia Tbk.
BGTG,Bank Ganesha Tbk.
BHIT,MNC Investama Tbk.
BIKA,Binakarya Jaya Abadi Tbk.
BIMA,Primarindo Asia Infrastructure Tbk.
BINA,Bank Ina Perdana Tbk.
BIPI,Astrindo Nusantara Infrastruktur Tbk.
BIPP,Bhuwanatala Indah Permai Tbk.
BIRD,Blue Bird Tbk.
BISI,BISI International Tbk.
BJBR,Bank Pembangunan Daerah Jawa Barat dan Banten Tbk.
BJTM,Bank Pembangunan Daerah Jawa Timur Tbk.
BKDP,Bukit Darmo Property Tbk
BKSL,Sentul City Tbk.
BKSW,Bank QNB Indonesia Tbk.
BLTA,Berlian Laju Tanker Tbk
BLTZ,Graha Layar Prima Tbk.
BMAS,Bank Maspion Indonesia Tbk.
BMRI,Bank Mandiri (Persero) Tbk.
BMSR,Bintang Mitra Semestaraya Tbk
BMTR,Global Mediacom Tbk.
BNBA,Bank Bumi Arta Tbk.
BNBR,Bakrie & Brothers Tbk
BNGA,Bank CIMB Niaga Tbk.
BNII,Bank Maybank Indonesia Tbk.
BNLI,Bank Permata Tbk.
BOGA,Bintang Oto Global Tbk.
BOLT,Garuda Metalindo Tbk.
BORN,Borneo Lumbung Energi & Metal Tbk.
BOSS,Borneo Olah Sarana Sukses Tbk.
BPFI,Batavia Prosperindo Finance Tbk.
BPII,Batavia Prosperindo Internasional Tbk.
BPTR,Batavia Prosperindo Trans Tbk.
BRAM,Indo Kordsa Tbk.
BRIS,Bank BRIsyariah Tbk.
BRMS,Bumi Resources Minerals Tbk.
BRNA,Berlina Tbk.
BRPT,Barito Pacific Tbk.
BSDE,Bumi Serpong Damai Tbk.
BSIM,Bank Sinarmas Tbk.
BSSR,Baramulti Suksessarana Tbk.
BSWD,Bank Of India Indonesia Tbk.
BTEK,Bumi Teknokultura Unggul Tbk
BTEL,Bakrie Telecom Tbk.
BTON,Betonjaya Manunggal Tbk.
BTPN,Bank Tabungan Pensiunan Nasional Tbk.
BTPS,Bank Tabungan Pensiunan Nasional Syariah Tbk.
BUDI,Budi Starch & Sweetener Tbk.
BUKK,Bukaka Teknik Utama Tbk.
BULL,Buana Lintas Lautan Tbk.
BUMI,Bumi Resources Tbk.
BUVA,Bukit Uluwatu Villa Tbk.
BVIC,Bank Victoria International Tbk.
BWPT,Eagle High Plantations Tbk.
BYAN,Bayan Resources Tbk.
CAKK,Cahayaputra Asa Keramik Tbk.
CAMP,Campina Ice Cream Industry Tbk.
CANI,Capitol Nusantara Indonesia Tbk.
CARS,Industri dan Perdagangan Bintraco Dharma Tbk.
CASA,Capital Financial Indonesia Tbk.
CASS,Cardig Aero Services Tbk.
CEKA,Wilmar Cahaya Indonesia Tbk.
CENT,Centratama Telekomunikasi Indonesia Tbk.
CFIN,Clipan Finance Indonesia Tbk.
CINT,Chitose Internasional Tbk.
CITA,Cita Mineral Investindo Tbk.
CITY,Natura City Developments Tbk.
CKRA,Cakra Mineral Tbk.
CLEO,Sariguna Primatirta Tbk.
CLPI,Colorpak Indonesia Tbk.
CMNP,Citra Marga Nusaphala Persada Tbk.
CMPP,AirAsia Indonesia Tbk.
CNKO,Exploitasi Energi Indonesia Tbk.
CNTB,Saham Seri B ( Centex Tbk )
CNTX,Century Textile Industry Tbk.
COWL,Cowell Development Tbk.
CPIN,Charoen Pokphand Indonesia Tbk
CPRO,Central Proteina Prima Tbk.
CSAP,Catur Sentosa Adiprana Tbk.
CSIS,Cahayasakti Investindo Sukses Tbk.
CTBN,Citra Tubindo Tbk.
CTRA,Ciputra Development Tbk.
CTTH,Citatah Tbk.
DART,Duta Anggada Realty Tbk.
DAYA,Duta Intidaya Tbk.
DEAL,Dewata Freightinternational Tbk.
DEFI,Danasupra Erapacific Tbk
DEWA,Darma Henwa Tbk
DFAM,Dafam Property Indonesia Tbk.
DGIK,Nusa Konstruksi Enjiniring Tbk.
DIGI,Arkadia Digital Media Tbk.
DILD,Intiland Development Tbk.
DIVA,Distribusi Voucher Nusantara Tbk.
DKFT,Central Omega Resources Tbk.
DLTA,Delta Djakarta Tbk.
DMAS,Puradelta Lestari Tbk.
DNAR,Bank Dinar Indonesia Tbk.
DNET,Indoritel Makmur Internasional Tbk.
DOID,Delta Dunia Makmur Tbk.
DPNS,Duta Pertiwi Nusantara Tbk.
DPUM,Dua Putra Utama Makmur Tbk.
DSFI,Dharma Samudera Fishing Industries Tbk.
DSNG,Dharma Satya Nusantara Tbk.
DSSA,Dian Swastatika Sentosa Tbk
DUCK,Jaya Bersama Indo Tbk.
DUTI,Duta Pertiwi Tbk
DVLA,Darya-Varia Laboratoria Tbk.
DWGL,Dwi Guna Laksana Tbk.
DYAN,Dyandra Media International Tbk.
ECII,Electronic City Indonesia Tbk.
EKAD,Ekadharma International Tbk.
ELSA,Elnusa Tbk.
ELTY,Bakrieland Development Tbk.
EMDE,Megapolitan Developments Tbk.
EMTK,Elang Mahkota Teknologi Tbk.
ENRG,Energi Mega Persada Tbk.
EPMT,Enseval Putera Megatrading Tbk.
ERAA,Erajaya Swasembada Tbk.
ERTX,Eratex Djaja Tbk.
ESSA,Surya Esa Perkasa Tbk.
ESTI,Ever Shine Tex Tbk.
ETWA,Eterindo Wahanatama Tbk
EXCL,XL Axiata Tbk.
FAST,Fast Food Indonesia Tbk.
FASW,Fajar Surya Wisesa Tbk.
FILM,MD Pictures Tbk.
FINN,First Indo American Leasing Tbk.
FIRE,Alfa Energi Investama Tbk.
FISH,FKS Multi Agro Tbk.
FMII,Fortune Mate Indonesia Tbk
FORU,Fortune Indonesia Tbk
FORZ,Forza Land Indonesia Tbk.
FPNI,Lotte Chemical Titan Tbk.
FREN,Smartfren Telecom Tbk.
GAMA,Gading Development Tbk.
GDST,Gunawan Dianjaya Steel Tbk.
GDYR,Goodyear Indonesia Tbk.
GEMA,Gema Grahasarana Tbk.
GEMS,Golden Energy Mines Tbk.
GGRM,Gudang Garam Tbk.
GHON,Gihon Telekomunikasi Indonesia Tbk.
GIAA,Garuda Indonesia (Persero) Tbk.
GJTL,Gajah Tunggal Tbk.
GLOB,Global Teleshop Tbk.
GMCW,Grahamas Citrawisata Tbk.
GMFI,Garuda Maintenance Facility Aero Asia Tbk.
GMTD,Gowa Makassar Tourism Development Tbk.
GOLD,Visi Telekomunikasi Infrastruktur Tbk.
GOLL,Golden Plantation Tbk.
GOOD,Garudafood Putra Putri Jaya Tbk.
GPRA,Perdana Gapuraprima Tbk.
GREN,Evergreen Invesco Tbk.
GSMF,Equity Development Investment Tbk.
GTBO,Garda Tujuh Buana Tbk
GWSA,Greenwood Sejahtera Tbk.
GZCO,Gozco Plantations Tbk.
HADE,Himalaya Energi Perkasa Tbk.
HDFA,Radana Bhaskara Finance Tbk.
HDTX,Panasia Indo Resources Tbk.
HEAL,Medikaloka Hermina Tbk.
HELI,Jaya Trishindo Tbk.
HERO,Hero Supermarket Tbk.
HEXA,Hexindo Adiperkasa Tbk.
HITS,Humpuss Intermoda Transportasi Tbk.
HKMU,HK Metals Utama Tbk.
HMSP,H.M. Sampoerna Tbk.
HOKI,Buyung Poetra Sembada Tbk.
HOME,Hotel Mandarine Regency Tbk.
HOTL,Saraswati Griya Lestari Tbk.
HRTA,Hartadinata Abadi Tbk.
HRUM,Harum Energy Tbk.
IATA,Indonesia Transport & Infrastructure Tbk.
IBFN,Intan Baruprana Finance Tbk.
IBST,Inti Bangun Sejahtera Tbk.
ICBP,Indofood CBP Sukses Makmur Tbk.
ICON,Island Concepts Indonesia Tbk.
IDPR,Indonesia Pondasi Raya Tbk.
IGAR,Champion Pacific Indonesia Tbk.
IIKP,Inti Agri Resources Tbk
IKAI,Intikeramik Alamasri Industri Tbk.
IKBI,Sumi Indo Kabel Tbk.
IMAS,Indomobil Sukses Internasional Tbk.
IMJS,Indomobil Multi Jasa Tbk.
IMPC,Impack Pratama Industri Tbk.
INAF,Indofarma Tbk.
INAI,Indal Aluminium Industry Tbk.
INCF,Indo Komoditi Korpora Tbk.
INCI,Intanwijaya Internasional Tbk
INCO,Vale Indonesia Tbk.
INDF,Indofood Sukses Makmur Tbk.
INDR,Indo-Rama Synthetics Tbk.
INDS,Indospring Tbk.
INDX,Tanah Laut Tbk
INDY,Indika Energy Tbk.
INKP,Indah Kiat Pulp & Paper Tbk.
INPC,Bank Artha Graha Internasional Tbk.
INPP,Indonesian Paradise Property Tbk.
INPS,Indah Prakasa Sentosa Tbk.
INRU,Toba Pulp Lestari Tbk.
INTA,Intraco Penta Tbk.
INTD,Inter Delta Tbk
INTP,Indocement Tunggal Prakarsa Tbk.
IPCC,Indonesia Kendaraan Terminal Tbk.
IPCM,Jasa Armada Indonesia Tbk.
IPOL,Indopoly Swakarsa Industry Tbk.
ISAT,Indosat Tbk.
ISSP,Steel Pipe Industry of Indonesia Tbk.
ITMA,Sumber Energi Andalan Tbk.
ITMG,Indo Tambangraya Megah Tbk.
ITTG,Leo Investments Tbk.
JAWA,Jaya Agra Wattie Tbk.
JECC,Jembo Cable Company Tbk.
JGLE,Graha Andrasentra Propertindo Tbk.
JIHD,Jakarta International Hotels & Development Tbk.
JKON,Jaya Konstruksi Manggala Pratama Tbk.
JKSW,Jakarta Kyoei Steel Works Tbk.
JMAS,Asuransi Jiwa Syariah Jasa Mitra Abadi Tbk.
JPFA,Japfa Comfeed Indonesia Tbk.
JRPT,Jaya Real Property Tbk.
JSKY,Sky Energy Indonesia Tbk.
JSMR,Jasa Marga (Persero) Tbk.
JSPT,Jakarta Setiabudi Internasional Tbk.
JTPE,Jasuindo Tiga Perkasa Tbk.
KAEF,Kimia Farma Tbk.
KARW,ICTSI Jasa Prima Tbk.
KBLI,KMI Wire & Cable Tbk.
KBLM,Kabelindo Murni Tbk.
KBLV,First Media Tbk.
KBRI,Kertas Basuki Rachmat Indonesia Tbk.
KDSI,Kedawung Setia Industrial Tbk.
KIAS,Keramika Indonesia Assosiasi Tbk.
KICI,Kedaung Indah Can Tbk
KIJA,Kawasan Industri Jababeka Tbk.
KINO,Kino Indonesia Tbk.
KIOS,Kioson Komersial Indonesia Tbk.
KKGI,Resource Alam Indonesia Tbk.
KLBF,Kalbe Farma Tbk.
KMTR,Kirana Megatara Tbk.
KOBX,Kobexindo Tractors Tbk.
KOIN,Kokoh Inti Arebama Tbk
KONI,Perdana Bangun Pusaka Tbk
KOPI,Mitra Energi Persada Tbk.
KPAL,Steadfast Marine Tbk.
KPAS,Cottonindo Ariesta Tbk.
KPIG,MNC Land Tbk.
KRAH,Grand Kartech Tbk.
KRAS,Krakatau Steel (Persero) Tbk.
KREN,Kresna Graha Investama Tbk.
LAND,Trimitra Propertindo Tbk.
LAPD,Leyand International Tbk.
LCGP,Eureka Prima Jakarta Tbk.
LCKM,LCK Global Kedaton Tbk.
LEAD,Logindo Samudramakmur Tbk.
LINK,Link Net Tbk.
LION,Lion Metal Works Tbk.
LMAS,Limas Indonesia Makmur Tbk
LMPI,Langgeng Makmur Industri Tbk.
LMSH,Lionmesh Prima Tbk.
LPCK,Lippo Cikarang Tbk
LPGI,Lippo General Insurance Tbk.
LPIN,Multi Prima Sejahtera Tbk
LPKR,Lippo Karawaci Tbk.
LPLI,Star Pacific Tbk
LPPF,Matahari Department Store Tbk.
LPPS,Lippo Securities Tbk.
LRNA,Eka Sari Lorena Transport Tbk.
LSIP,PP London Sumatra Indonesia Tbk.
LTLS,Lautan Luas Tbk.
LUCK,Sentral Mitra Informatika Tbk.
MABA,Marga Abhinaya Abadi Tbk.
MAGP,Multi Agro Gemilang Plantation Tbk.
MAIN,Malindo Feedmill Tbk.
MAMI,Mas Murni Indonesia Tbk
MAMIP,Mas Murni Tbk (Saham Preferen)
MAPA,Map Aktif Adiperkasa Tbk.
MAPB,MAP Boga Adiperkasa Tbk.
MAPI,Mitra Adiperkasa Tbk.
MARI,Mahaka Radio Integra Tbk.
MARK,Mark Dynamics Indonesia Tbk.
MASA,Multistrada Arah Sarana Tbk.
MAYA,Bank Mayapada Internasional Tbk.
MBAP,Mitrabara Adiperdana Tbk.
MBSS,Mitrabahtera Segara Sejati Tbk.
MBTO,Martina Berto Tbk.
MCAS,M Cash Integrasi Tbk.
MCOR,Bank China Construction Bank Indonesia Tbk.
MDIA,Intermedia Capital Tbk.
MDKA,Merdeka Copper Gold Tbk.
MDKI,Emdeki Utama Tbk.
MDLN,Modernland Realty Tbk.
MDRN,Modern Internasional Tbk.
MEDC,Medco Energi Internasional Tbk.
MEGA,Bank Mega Tbk.
MERK,Merck Tbk.
META,Nusantara Infrastructure Tbk.
MFIN,Mandala Multifinance Tbk.
MFMI,Multifiling Mitra Indonesia Tbk.
MGNA,Magna Investama Mandiri Tbk.
MGRO,Mahkota Group Tbk.
MICE,Multi Indocitra Tbk.
MIDI,Midi Utama Indonesia Tbk.
MIKA,Mitra Keluarga Karyasehat Tbk.
MINA,Sanurhasta Mitra Tbk.
MIRA,Mitra International Resources Tbk.
MITI,Mitra Investindo Tbk.
MKNT,Mitra Komunikasi Nusantara Tbk.
MKPI,Metropolitan Kentjana Tbk.
MLBI,Multi Bintang Indonesia Tbk.
MLIA,Mulia Industrindo Tbk
MLPL,Multipolar Tbk.
MLPT,Multipolar Technology Tbk.
MMLP,Mega Manunggal Property Tbk.
MNCN,Media Nusantara Citra Tbk.
MOLI,Madusari Murni Indah Tbk.
MPMX,Mitra Pinasthika Mustika Tbk.
MPOW,Megapower Makmur Tbk.
MPPA,Matahari Putra Prima Tbk.
MPRO,Propertindo Mulia Investama Tbk.
MRAT,Mustika Ratu Tbk.
MREI,Maskapai Reasuransi Indonesia Tbk.
MSIN,MNC Studios International Tbk.
MSKY,MNC Sky Vision Tbk.
MTDL,Metrodata Electronics Tbk.
MTFN,Capitalinc Investment Tbk.
MTLA,Metropolitan Land Tbk.
MTRA,Mitra Pemuda Tbk.
MTSM,Metro Realty Tbk.
MTWI,Malacca Trust Wuwungan Insurance Tbk.
MYOH,Samindo Resources Tbk.
MYOR,Mayora Indah Tbk.
MYRX,Hanson International Tbk.
MYRXP,Saham Seri B Hanson International Tbk.
MYTX,Asia Pacific Investama Tbk.
NAGA,Bank Mitraniaga Tbk.
NASA,Ayana Land International Tbk.
NELY,Pelayaran Nelly Dwi Putri Tbk.
NFCX,NFC Indonesia Tbk.
NICK,Charnic Capital Tbk.
NIKL,Pelat Timah Nusantara Tbk.
NIPS,Nipress Tbk.
NIRO,City Retail Developments Tbk.
NISP,Bank OCBC NISP Tbk.
NOBU,Bank Nationalnobu Tbk.
NRCA,Nusa Raya Cipta Tbk.
NUSA,Sinergi Megah Internusa Tbk.
OASA,Protech Mitra Perkasa Tbk.
OCAP,Onix Capital Tbk.
OKAS,Ancora Indonesia Resources Tbk.
OMRE,Indonesia Prima Property Tbk
PADI,Minna Padi Investama Sekuritas Tbk.
PALM,Provident Agro Tbk.
PANI,Pratama Abadi Nusa Industri Tbk.
PANR,Panorama Sentrawisata Tbk.
PANS,Panin Sekuritas Tbk.
PBID,Panca Budi Idaman Tbk.
PBRX,Pan Brothers Tbk.
PBSA,Paramita Bangun Sarana Tbk.
PCAR,Prima Cakrawala Abadi Tbk.
PDES,Destinasi Tirta Nusantara Tbk
PEGE,Panca Global Kapital Tbk.
PEHA,Phapros Tbk.
PGAS,Perusahaan Gas Negara (Persero) Tbk.
PGLI,Pembangunan Graha Lestari Indah Tbk.
PICO,Pelangi Indah Canindo Tbk
PJAA,Pembangunan Jaya Ancol Tbk.
PKPK,Perdana Karya Perkasa Tbk
PLAS,Polaris Investama Tbk
PLIN,Plaza Indonesia Realty Tbk.
PNBN,Bank Pan Indonesia Tbk
PNBS,Bank Panin Dubai Syariah Tbk.
PNIN,Paninvest Tbk.
PNLF,Panin Financial Tbk.
PNSE,Pudjiadi & Sons Tbk.
POLA,Pool Advista Finance Tbk.
POLL,Pollux Properti Indonesia Tbk.
POLY,Asia Pacific Fibers Tbk
POOL,Pool Advista Indonesia Tbk.
PORT,Nusantara Pelabuhan Handal Tbk.
POWR,Cikarang Listrindo Tbk.
PPRE,PP Presisi Tbk.
PPRO,PP Properti Tbk.
PRAS,Prima Alloy Steel Universal Tbk.
PRDA,Prodia Widyahusada Tbk.
PRIM,Royal Prima Tbk.
PSAB,J Resources Asia Pasifik Tbk.
PSDN,Prasidha Aneka Niaga Tbk
PSKT,Red Planet Indonesia Tbk.
PSSI,Pelita Samudera Shipping Tbk.
PTBA,Bukit Asam Tbk.
PTIS,Indo Straits Tbk.
PTPP,PP (Persero) Tbk.
PTRO,Petrosea Tbk.
PTSN,Sat Nusapersada Tbk
PTSP,Pioneerindo Gourmet International Tbk.
PUDP,Pudjiadi Prestige Tbk.
PWON,Pakuwon Jati Tbk.
PYFA,Pyridam Farma Tbk
PZZA,Sarimelati Kencana Tbk.
RAJA,Rukun Raharja Tbk.
RALS,Ramayana Lestari Sentosa Tbk.
RANC,Supra Boga Lestari Tbk.
RBMS,Ristia Bintang Mahkotasejati Tbk.
RDTX,Roda Vivatex Tbk
RELI,Reliance Sekuritas Indonesia Tbk.
RICY,Ricky Putra Globalindo Tbk
RIGS,Rig Tenders Indonesia Tbk.
RIMO,Rimo International Lestari Tbk
RISE,Jaya Sukses Makmur Sentosa Tbk.
RMBA,Bentoel Internasional Investama Tbk.
RODA,Pikko Land Development Tbk.
ROTI,Nippon Indosari Corpindo Tbk.
RUIS,Radiant Utama Interinsco Tbk.
SAFE,Steady Safe Tbk
SAME,Sarana Meditama Metropolitan Tbk.
SAPX,Satria Antaran Prima Tbk.
SATU,Kota Satu Properti Tbk.
SCBD,Danayasa Arthatama Tbk.
SCCO,Supreme Cable Manufacturing & Commerce Tbk.
SCMA,Surya Citra Media Tbk.
SCPI,Merck Sharp Dohme Pharma Tbk.
SDMU,Sidomulyo Selaras Tbk.
SDPC,Millennium Pharmacon International Tbk.
SDRA,Bank Woori Saudara Indonesia 1906 Tbk.
SGRO,Sampoerna Agro Tbk.
SHID,Hotel Sahid Jaya International Tbk.
SHIP,Sillo Maritime Perdana Tbk.
SIAP,Sekawan Intipratama Tbk
SIDO,Industri Jamu dan Farmasi Sido Muncul Tbk.
SILO,Siloam International Hospitals Tbk.
SIMA,Siwani Makmur Tbk
SIMP,Salim Ivomas Pratama Tbk.
SIPD,Sierad Produce Tbk.
SKBM,Sekar Bumi Tbk.
SKLT,Sekar Laut Tbk.
SKRN,Superkrane Mitra Utama Tbk.
SKYB,Skybee Tbk.
SMAR,Smart Tbk.
SMBR,Semen Baturaja (Persero) Tbk.
SMCB,Holcim Indonesia Tbk.
SMDM,Suryamas Dutamakmur Tbk.
SMDR,Samudera Indonesia  Tbk.
SMGR,Semen Indonesia (Persero) Tbk.
SMMA,Sinarmas Multiartha Tbk.
SMMT,Golden Eagle Energy Tbk.
SMRA,Summarecon Agung Tbk.
SMRU,SMR Utama Tbk.
SMSM,Selamat Sempurna Tbk.
SOCI,Soechi Lines Tbk.
SONA,Sona Topas Tourism Industry Tbk.
SOSS,Shield On Service Tbk.
SOTS,Satria Mega Kencana Tbk.
SPMA,Suparma Tbk.
SPTO,Surya Pertiwi Tbk.
SQMI,Renuka Coalindo Tbk.
SRAJ,Sejahteraraya Anugrahjaya Tbk.
SRIL,Sri Rejeki Isman Tbk.
SRSN,Indo Acidatama Tbk
SRTG,Saratoga Investama Sedaya Tbk.
SSIA,Surya Semesta Internusa Tbk.
SSMS,Sawit Sumbermas Sarana Tbk.
SSTM,Sunson Textile Manufacture Tbk
STAR,Star  Petrochem Tbk.
STTP,Siantar Top Tbk.
SUGI,Sugih Energy Tbk.
SULI,SLJ Global Tbk.
SUPR,Solusi Tunas Pratama Tbk.
SURE,Super Energy Tbk.
SWAT,Sriwahana Adityakarta Tbk.
TALF,Tunas Alfin Tbk.
TAMU,Pelayaran Tamarin Samudra Tbk.
TARA,Sitara Propertindo Tbk.
TAXI,Express Transindo Utama Tbk.
TBIG,Tower Bersama Infrastructure Tbk.
TBLA,Tunas Baru Lampung Tbk.
TBMS,Tembaga Mulia Semanan Tbk.
TCID,Mandom Indonesia Tbk.
TCPI,Transcoal Pacific Tbk.
TDPM,Tridomain Performance Materials Tbk.
TELE,Tiphone Mobile Indonesia Tbk.
TFCO,Tifico Fiber Indonesia Tbk.
TGKA,Tigaraksa Satria Tbk.
TGRA,Terregra Asia Energy Tbk.
TIFA,Tifa Finance Tbk.
TINS,Timah Tbk.
TIRA,Tira Austenite Tbk
TIRT,Tirta Mahakam Resources Tbk
TKIM,Pabrik Kertas Tjiwi Kimia Tbk.
TLKM,Telekomunikasi Indonesia (Persero) Tbk.
TMAS,Pelayaran Tempuran Emas Tbk.
TMPI,Sigmagold Inti Perkasa Tbk.
TMPO,Tempo Intimedia Tbk.
TNCA,Trimuda Nuansa Citra Tbk.
TOBA,Toba Bara Sejahtra Tbk.
TOPS,Totalindo Eka Persada Tbk.
TOTL,Total Bangun Persada Tbk.
TOTO,Surya Toto Indonesia Tbk.
TOWR,Sarana Menara Nusantara Tbk.
TPIA,Chandra Asri Petrochemical Tbk.
TPMA,Trans Power Marine Tbk.
TRAM,Trada Alam Minera Tbk.
TRIL,Triwira Insanlestari Tbk.
TRIM,Trimegah Sekuritas Indonesia Tbk.
TRIO,Trikomsel Oke Tbk.
TRIS,Trisula International Tbk.
TRST,Trias Sentosa Tbk.
TRUK,Guna Timur Raya Tbk.
TRUS,Trust Finance Indonesia Tbk
TSPC,Tempo Scan Pacific Tbk.
TUGU,Asuransi Tugu Pratama Indonesia Tbk.
TURI,Tunas Ridean Tbk.
ULTJ,"Ultra Jaya Milk Industry & Trading Company, Tbk."
UNIC,Unggul Indah Cahaya Tbk.
UNIT,Nusantara Inti Corpora Tbk
UNSP,Bakrie Sumatera Plantations Tbk.
UNTR,United Tractors Tbk.
UNVR,Unilever Indonesia Tbk.
URBN,Urban Jakarta Propertindo Tbk.
VICO,Victoria Investama Tbk.
VINS,Victoria Insurance Tbk.
VIVA,Visi Media Asia Tbk.
VOKS,Voksel Electric Tbk.
VRNA,Verena Multi Finance Tbk.
WAPO,Wahana Pronatural Tbk.
WEGE,Wijaya Karya Bangunan Gedung Tbk.
WEHA,WEHA Transportasi Indonesia Tbk.
WICO,Wicaksana Overseas International Tbk.
WIIM,Wismilak Inti Makmur Tbk.
WIKA,Wijaya Karya (Persero) Tbk.
WINS,Wintermar Offshore Marine Tbk.
WOMF,Wahana Ottomitra Multiartha Tbk.
WOOD,Integra Indocabinet Tbk.
WSBP,Waskita Beton Precast Tbk.
WSKT,Waskita Karya (Persero) Tbk.
WTON,Wijaya Karya Beton Tbk.
YELO,Yelooo Integra Datanet Tbk.
YPAS,Yanaprima Hastapersada Tbk
YULE,Yulie Sekuritas Indonesia Tbk.
ZBRA,Zebra Nusantara Tbk
ZINC,Kapuas Prima Coal Tbk.
ZONE,Mega Perintis Tbk.
FOOD,Sentra Food Indonesia Tbk.
BEEF,Estika Tata Tiara Tbk.
POLI,Pollux Investasi Internasional Tbk.
CLAY,Citra Putra Realty Tbk.
NATO,Nusantara Properti Internasional Tbk.
JAYA,Armada Berjaya Trans Tbk.
BTPN,Bank BTPN Tbk.
COCO,Wahana Interfood Nusantara Tbk.
CPRI,Capri Nusa Satu Properti Tbk.
HRME,Menteng Heritage Realty Tbk.
MTPS,Meta Epsi Tbk.
SKYB,Northcliff Citranusa Indonesia Tbk.
SMCB,Solusi Bangun Indonesia Tbk.
KAEF,Kimia Farma (Persero) Tbk.
PGAS,Perusahaan Gas Negara Tbk.
POSA,Bliss Properti Indonesia Tbk.
FITT,Hotel Fitra International Tbk.
INAF,Indofarma (Persero) Tbk.
JAST,Jasnita Telekomindo Tbk.
BOLA,Bali Bintang Sejahtera Tbk.
CCSI,Communication Cable Systems Indonesia Tbk.
ITIC,Indonesian Tobacco Tbk.
KAYU,Darmi Bersaudara Tbk.
KJEN,Krida Jaringan Nusantara Tbk.
POLU,Golden Flower Tbk.
SFAN,Surya Fajar Capital Tbk.
STAR,Buana Artha Anugerah Tbk.
ARKA,Arkha Jayanti Persada Tbk.
BLUE,Berkah Prima Perkasa Tbk.
EAST,Eastparc Hotel Tbk.
ENVY,Envy Technologies Indonesia Tbk.
FUJI,Fuji Finance Indonesia Tbk.
HDIT,Hensel Davest Indonesia Tbk.
INOV,Inocycle Technology Group Tbk.
IPTV,MNC Vision Networks Tbk.
KOTA,DMS Propertindo Tbk.
LIFE,Asuransi Jiwa Sinarmas MSIG Tbk.
PAMG,Bima Sakti Pertiwi Tbk.
SMKL,Satyamitra Kemas Lestari Tbk.
DNAR,Bank Oke Indonesia Tbk.
KEEN,Kencana Energi Lestari Tbk.
TMAS,Temas Tbk.
AGRS,Bank IBK Indonesia Tbk.
BAPI,Bhakti Agung Propertindo Tbk.
GGRP,Gunung Raja Paksi Tbk.
NZIA,Nusantara Almazia Tbk.
OPMS,Optima Prima Metal Sinergi Tbk.
TFAS,Telefast Indonesia Tbk.
IRRA,Itama Ranoraya Tbk.
MPRO,Maha Properti Indonesia Tbk.
PURE,Trinitan Metals and Minerals Tbk.
SLIS,Gaya Abadi Sempurna Tbk.
DMMX,Digital Mediatama Maxima Tbk.
ESIP,Sinergi Inti Plastindo Tbk.
KEJU,Mulia Boga Raya Tbk.
PSGO,Palma Serasih Tbk.
SINI,Singaraja Putra Tbk.
SQMI,Wilton Makmur Indonesia Tbk.
TEBE,Dana Brata Luhur Tbk.
WOWS,Ginting Jaya Energi Tbk.
AGAR,Asia Sejahtera Mina Tbk.
IFSH,Ifishdeco Tbk.
REAL,Repower Asia Indonesia Tbk.
IFII,Indonesia Fibreboard Industry Tbk.
PMJS,Putra Mandiri Jembar Tbk.
UCID,Uni-Charm Indonesia Tbk.
GLVA,Galva Technologies Tbk.
DEFI,Danasupra Erapacific Tbk.
PGJO,Tourindo Guide Indonesia Tbk.
AMAR,Bank Amar Indonesia Tbk.
CSRA,Cisadane Sawit Raya Tbk.
INDO,Royalindo Investa Wijaya Tbk.
AMOR,Ashmore Asset Management Indonesia Tbk.
TRIN,Perintis Triniti Properti Tbk.
AKSI,Maming Enam Sembilan Mineral Tbk.
DMND,Diamond Food Indonesia Tbk.
PURA,Putra Rajawali Kencana Tbk.
PTPW,Pratama Widya Tbk.
TAMA,Lancartama Sejati Tbk.
AYLS,Agro Yasa Lestari Tbk.
IKAN,Era Mandiri Cemerlang Tbk.
DADA,Diamond Citra Propertindo Tbk.
ASPI,Andalan Sakti Primaindo Tbk.
BESS,Batulicin Nusantara Maritim Tbk.
ESTA,Esta Multi Usaha Tbk.
AMAN,Makmur Berkah Amanda Tbk.
CARE,Metro Healthcare Indonesia Tbk.
BBSS,Bumi Benowo Sukses Sejahtera Tbk.
BHAT,Bhakti Multi Artha Tbk.
CBMF,Cahaya Bintang Medan Tbk.
CSMI,Cipta Selera Murni Tbk.
KBAG,Karya Bersama Anugerah Tbk.
RONY,Aesler Grup Internasional Tbk.
SAMF,Saraswanti Anugerah Makmur Tbk.
SBAT,Sejahtera Bintang Abadi Textile Tbk.
CASH,Cashlez Worldwide Indonesia Tbk.
TECH,Indosterling Technomedia Tbk.
BTPS,Bank BTPN Syariah Tbk.
ARTO,Bank Jago Tbk.
EPAC,Megalestari Epack Sentosaraya Tbk.
GAMA,Aksara Global Development Tbk.
PGUN,Pradiksi Gunatama Tbk.
PPGL,Prima Globalindo Logistik Tbk.
SOFA,Boston Furniture Industries Tbk.
UANG,Pakuan Tbk.
SGER,Sumber Global Energy Tbk.
TOYS,Sunindo Adipersada Tbk.
PNGO,Pinago Utama Tbk.
TRJA,Transkon Jaya Tbk.
BBSI,Bank Bisnis Internasional Tbk.
BBYB,Bank Neo Commerce Tbk.
ENZO,Morenzo Abadi Perkasa Tbk.
HOMI,Grand House Mulia Tbk.
KMDS,Kurniamitra Duta Sentosa Tbk.
LPPS,Lenox Pasifik Investama Tbk.
PLAN,Planet Properindo Jaya Tbk.
PURI,Puri Global Sukses Tbk.
ROCK,Rockfields Properti Indonesia Tbk.
SCNP,Selaras Citra Nusantara Perkasa Tbk.
SOHO,Soho Global Health Tbk.
TIFA,KDB Tifa Finance Tbk.
TOBA,TBS Energi Utama Tbk.
NASA,Andalan Perkasa Abadi Tbk.
SIPD,Sreeya Sewu Indonesia Tbk.
TARA,Agung Semesta Sejahtera Tbk.
NATO,Surya Permata Andalan Tbk.
TLKM,Telkom Indonesia (Persero) Tbk.
PTDU,Djasa Ubersakti Tbk.
ATAP,Trimitra Prawara Goldland Tbk.
VICI,Victoria Care Indonesia Tbk.
PMMP,Panca Mitra Multiperdana Tbk.
WIFI,Solusi Sinergi Digital Tbk.
FAPA,FAP Agri Tbk.
DCII,DCI Indonesia Tbk.
DGNS,Diagnos Laboratorium Utama Tbk.
BANK,Bank Net Indonesia Syariah Tbk.
BRIS,Bank Syariah Indonesia Tbk.
UFOE,Damai Sejahtera Abadi Tbk.
WMUU,Widodo Makmur Unggas Tbk.
EDGE,Indointernet Tbk.
BBKP,Bank KB Bukopin Tbk.
ASMI,Asuransi Maximus Graha Persada Tbk.
UNIQ,Ulima Nitra Tbk.
BEBS,Berkah Beton Sadaya Tbk.
SNLK,Sunter Lakeside Hotel Tbk.
AISA,FKS Food Sejahtera Tbk.
ZYRX,Zyrexindo Mandiri Buana Tbk.
FIMP,Fimperkasa Utama Tbk.
LFLO,Imago Mulia Persada Tbk.
NPGF,Nusa Palapa Gemilang Tbk.
SCPI,Organon Pharma Indonesia Tbk.
TAPG,Triputra Agro Persada Tbk.
LUCY,Lima Dua Lima Tiga Tbk.
HOPE,Harapan Duta Pertiwi Tbk.
MGLV,Panca Anugrah Wisesa Tbk.
ARCI,Archi Indonesia Tbk.
IPAC,Era Graharealty Tbk.
LABA,Ladangbaja Murni Tbk.
MASB,Bank Multiarta Sentosa Tbk.
TRUE,Triniti Dinamik Tbk.
BANK,Bank Aladin Syariah Tbk.
BBHI,Allo Bank Indonesia Tbk.
BMHS,Bundamedik Tbk.
FLMC,Falmaco Nonwoven Industri Tbk.
GLOB,Globe Kita Terang Tbk.
NICL,PAM Mineral Tbk.
BUKA,Bukalapak.com Tbk.
UVCR,Trimegah Karya Pratama Tbk.
GPSO,Geoprima Solusi Tbk.
HAIS,Hasnur Internasional Shipping Tbk.
OILS,Indo Oil Perkasa Tbk.
CMNT,Cemindo Gemilang Tbk.
GTSI,GTS Internasional Tbk.
IDEA,Idea Indonesia Akademi Tbk.
MCOL,Prima Andalan Mandiri Tbk.
RSGK,Kedoya Adyaraya Tbk.
RUNS,Global Sukses Solusi Tbk.
SBMA,Surya Biru Murni Acetylene Tbk.
BOBA,Formosa Ingredient Factory Tbk.
KUAS,Ace Oldfields Tbk.
POLL,Pollux Properties Indonesia Tbk.
AGRO,Bank Raya Indonesia Tbk.
BINO,Perma Plasindo Tbk.
DEPO,Caturkarda Depo Bangunan Tbk.
MTEL,Dayamitra Telekomunikasi Tbk.
POLI,Pollux Hotels Group Tbk.
CMRY,Cisarua Mountain Dairy Tbk.
TAYS,Jaya Swarasa Agung Tbk.
WGSH,Wira Global Solusi Tbk.
WMPP,Widodo Makmur Perkasa Tbk.
RMKE,RMK Energy Tbk.
AVIA,Avia Avian Tbk.
OBMD,OBM Drilchem Tbk.
IPPE,Indo Pureco Pratama Tbk.
NASI,Wahana Inti Makmur Tbk.
BSML,Bintang Samudera Mandiri Lines Tbk.
DRMA,Dharma Polimetal Tbk.
ADMR,Adaro Minerals Indonesia Tbk.
SEMA,Semacom Integrated Tbk.
AKSI,Mineral Sumberdaya Mandiri Tbk.
ASLC,Autopedia Sukses Lestari Tbk.
NETV,Net Visi Media Tbk.
BAUT,Mitra Angkasa Sejahtera Tbk.
ENAK,Champ Resto Indonesia Tbk.
NTBK,Nusatama Berkah Tbk.
ADCP,Adhi Commuter Properti Tbk.
NANO,Nanotech Indonesia Global Tbk.
SMKM,Sumber Mas Konstruksi Tbk.
STAA,Sumber Tani Agung Resources Tbk.
IATA,MNC Energy Investments Tbk.
